{
  "definitions": {},
  "$schema": "http://json-schema.org/draft-04/schema#",
  "type": "object",
  "title": "Add Picture Schema",
  "required": ["user_id", "img_name", "img_desc", "image"],
  "properties": {
    "user_id": {
      "type": "string",
      "default": "N.A."
    },
    "img_name": {
      "type": "string",
      "default": "N.A."
    },
    "img_desc": {
      "type": "string",
      "default": "N.A."
    },
    "image": {
      "type": "string"
    }
  }
}